{
  "index": 1,
  "channel": "stable",
  "library": "qet-official",
  "version": 42,
  "updated": "2026-09-18T00:00:00Z",
  "expires": "2026-09-25T00:00:00Z",
  "snapshot": "sha256:00000000000000000000000000000000000000000000000000000000000000ff",
  "elements": [
    { "uuid": "{8f1c2a3b-0000-4000-8000-000000000001}", "version": "2.1.0",
      "hash": "sha256:0000000000000000000000000000000000000000000000000000000000000001", "size": 4096 },
    { "uuid": "{b2040000-0000-4000-8000-000000000002}", "version": "1.4.0", "status": "withdrawn",
      "withdrawn_at": "2026-08-30", "withdrawal_class": "rights" }
  ]
}
